{
  "manifest_version": "cubeengine.project-manifest/2.0-alpha.2",
  "project_id": "project:snake.game.with.python.and.pygame.llm.source",
  "revision": 1,
  "content_hash": "fa001d000e66a29e0b47133bbc9cba8180fc95bb9f8d21c00a7a103a2f94f668",
  "metadata": {
    "title": "Snake Game with Python and Pygame",
    "description": ""
  },
  "variant": "source",
  "source_manifest": null,
  "documents": {
    "rule_ir": {
      "document_id": "rule:game.snake.game.with.python.and.pygame.source",
      "ir_version": "cubeengine.rule-ir/2.0-alpha.1",
      "content_hash": "679750ba075ccc96c45a80118e06dfd6217b8e77f399b6cf3c3f00e6dcb49f6b"
    },
    "scene_ir": {
      "document_id": "scene:game.snake.game.with.python.and.pygame.source",
      "ir_version": "cubeengine.scene-ir/2.0-alpha.1",
      "content_hash": "272a86893b75474c9be73ae1c87a1b4165d81b444f44836b43eb8f35400f5d0f"
    },
    "asset_ir": {
      "document_id": "asset:game.snake.game.with.python.and.pygame.source",
      "ir_version": "cubeengine.asset-ir/2.0-alpha.1",
      "content_hash": "5a36007e7871ae9bcf8ce8728fb368a15feb2603faa01f7863bf7eb17e5ef645"
    },
    "input_ir": {
      "document_id": "input:game.snake.game.with.python.and.pygame.source",
      "ir_version": "cubeengine.input-ir/2.0-alpha.1",
      "content_hash": "5e29d7df2ece39374db0f1219fab836d15d5deca3cc7c68108ecc97c5687f304"
    }
  },
  "extensions": [],
  "provenance": {
    "llm_proposal_id": "proposal:f49a25b6900b",
    "prompt_template_version": "cubeengine.srtp/llm-prompt/2.0",
    "designer_approved": true,
    "approved_by": "cli"
  },
  "unresolved": []
}
