{
  "manifest_version": "cubeengine.project-manifest/2.0-alpha.2",
  "project_id": "project:tic.tac.toe.llm.target",
  "revision": 0,
  "content_hash": "6132fb6a86804982b79fe07da684fcededa912e22f9d5009939801838845052d",
  "metadata": {
    "title": "Tic Tac Toe (target)",
    "description": ""
  },
  "variant": "target",
  "source_manifest": {
    "project_id": "project:tic.tac.toe.llm.source",
    "content_hash": "d1a2e973b2dab630f967d07456891a2fb0d737f14b5936ca055109d15f7be9b1"
  },
  "documents": {
    "rule_ir": {
      "document_id": "rule:game.tic.tac.toe.target",
      "ir_version": "cubeengine.rule-ir/2.0-alpha.1",
      "content_hash": "f0e3619820c46d47304fee64ea2e2fd3a0d7a79ca86a9983ee5ef5eeba16cc24"
    },
    "scene_ir": {
      "document_id": "scene:game.tic.tac.toe.target",
      "ir_version": "cubeengine.scene-ir/2.0-alpha.1",
      "content_hash": "4418d342c2eb52a6cfc0211eab81cb2213707d1cfa2a13d0436d842d756c171c"
    },
    "asset_ir": {
      "document_id": "asset:game.tic.tac.toe.target",
      "ir_version": "cubeengine.asset-ir/2.0-alpha.1",
      "content_hash": "78382910fec2fa3c05aaa036319bc0835bfa2495d6105540f3fe855759599199"
    },
    "input_ir": {
      "document_id": "input:game.tic.tac.toe.target",
      "ir_version": "cubeengine.input-ir/2.0-alpha.1",
      "content_hash": "277a56d64cb117ad8d7d9af3dae1f54da28b8235f4762e0cc8fabf67a92a0d2c"
    }
  },
  "extensions": [],
  "provenance": {
    "llm_proposal_id": "proposal:00678e371be7",
    "prompt_template_version": "cubeengine.srtp/llm-prompt/2.0"
  },
  "unresolved": [
    {
      "path": "/provenance/llm",
      "reason": "LLM proposal has not been designer-approved.",
      "required": true,
      "owner": "designer"
    }
  ]
}
